{
  "schema_version": 1,
  "code": "IN",
  "name": "India",
  "barcode_prefixes": [
    "890"
  ],
  "default_nutrition_basis": "per_100g",
  "sodium_declared_as": "sodium",
  "languages": [
    "en",
    "hi",
    "pa",
    "bn",
    "ta",
    "te",
    "mr",
    "gu",
    "kn",
    "ml"
  ],
  "notes": "Indian packaged food labels normally declare nutrition per 100 g or per 100 ml, and often print a per-serving column alongside it. Sodium is usually declared rather than salt. A 890 barcode prefix indicates a GS1 India member, which is a hint about the company, not proof of where the product was manufactured."
}
